{
  "$schema": "http://json-schema.org/draft-07/schema#",
  "$id": "https://correctby.design/undrift/schema.json",
  "title": "undrift configuration",
  "description": "Points undrift at a design system's own artifacts. Generated by `undrift init`.",
  "type": "object",
  "additionalProperties": false,
  "required": ["system", "profiles"],
  "anyOf": [{ "required": ["tokens"] }, { "required": ["tokensCss"] }],
  "properties": {
    "$schema": { "type": "string" },
    "system": {
      "type": "string",
      "description": "The design system's package name, e.g. @acme/ds. Used in violation messages and as the default systemImports entry."
    },
    "tokens": {
      "type": "string",
      "description": "Path to a DTCG/JSON token file. Merged with tokensCss; later sources win on collision."
    },
    "tokensCss": {
      "description": "Path, or paths, to stylesheets declaring CSS custom properties. Merged in order after `tokens`. light-dark(a, b) values resolve to a.",
      "oneOf": [
        { "type": "string" },
        { "type": "array", "items": { "type": "string" }, "minItems": 1 }
      ]
    },
    "catalog": {
      "type": "string",
      "description": "Path to a CATALOG.md. Richer than componentsFrom (carries for/not-for prose), but treated as possibly incomplete, so no-unknown-components will not fire against it."
    },
    "componentsFrom": {
      "type": "string",
      "description": "Path to the package's .d.ts entry point. Resolved transitively, so compound parts (TableRow, TableCell) are found. Yields a complete catalog, which enables no-unknown-components."
    },
    "componentsRoot": {
      "type": "string",
      "description": "Directory of component source, used by `undrift audit` for docs-coverage."
    },
    "systemImports": {
      "type": "array",
      "items": { "type": "string" },
      "description": "Import specifiers treated as the design system. Subpaths match automatically. Defaults to [system]."
    },
    "exemptMarker": {
      "type": "string",
      "default": "token-exempt",
      "description": "Comment marker granting a per-line exemption. Must be followed by ': <reason>' — a bare marker does not exempt."
    },
    "intrinsics": {
      "type": "object",
      "description": "Raw HTML elements that have a system equivalent. null means the element is still banned but has no replacement to name.",
      "additionalProperties": { "type": ["string", "null"] }
    },
    "foreignUi": {
      "type": "array",
      "items": { "type": "string" },
      "description": "Import prefixes treated as competing UI libraries."
    },
    "profiles": {
      "type": "object",
      "description": "Named file sets and the rules applied to each.",
      "minProperties": 1,
      "additionalProperties": {
        "type": "object",
        "additionalProperties": false,
        "required": ["include"],
        "properties": {
          "include": {
            "type": "array",
            "items": { "type": "string" },
            "minItems": 1,
            "description": "fast-glob patterns, relative to the config file. Negate with a leading '!'."
          },
          "rules": {
            "type": "array",
            "uniqueItems": true,
            "items": {
              "enum": [
                "no-raw-colors",
                "no-arbitrary-values",
                "no-raw-elements",
                "no-foreign-ui-imports",
                "no-inline-style-values",
                "no-unknown-tokens",
                "no-unknown-components"
              ]
            },
            "description": "Omit to apply all rules."
          }
        }
      }
    }
  }
}
